event,date,doi,title,author,selectedPublicationsCount,posInSuggestions,activationSourceComponent,actionDetails
Pub suggested,16:0:59,10.1109/mcg.2011.103,Treevis.net: a Tree Visualization Reference,Schulz,12,40,
Pub suggested,16:0:59,10.1007/978-3-642-17289-2_33,Indented Pixel Tree Plots,Burch et al.,12,41,
Pub suggested,16:0:59,10.1145/1753326.1753357,Crowdsourcing graphical perception:  using mechanical turk to assess visualization design,Heer and Bostock,12,42,
Pub suggested,16:0:59,10.1057/ivs.2009.4,Quantifying the Space-Efficiency of 2D Graphical Representations of Trees,Mcguffin and Robert,12,43,
Pub suggested,16:0:59,10.1109/iv.2008.20,A Dual-View Visualization of In-Car Communication Processes,Sedlmair et al.,12,44,
Pub suggested,16:0:59,10.1109/tvcg.2006.200,Visualizing Business Data with Generalized Treemaps,Vliegen et al.,12,45,
Pub suggested,16:0:59,10.1145/882262.882291,TreeJuxtaposer:  scalable tree comparison using Focus+Context with guaranteed visibility,Munzner et al.,12,46,
Pub suggested,16:0:59,10.1109/2945.981848,ThemeRiver: visualizing thematic changes in large document collections,Havre et al.,12,47,
Pub suggested,16:0:59,10.1145/571647.571649,Ordered and quantum treemaps:  Making effective use of 2D space to display hierarchies,Bederson et al.,12,48,
Pub suggested,16:0:59,10.1145/632716.632834,Visualizing the stock market,Wattenberg,12,49,
Pub suggested,16:0:59,10.1177/1473871611424815,Innovation trajectories for information visualizations: Comparing treemaps_ cone trees_ and hyperbolic trees,Shneiderman et al.,12,50,
Update,16:0:59,,,,,,,12
Network mode changed,16:1:43,,,,,,,Clusters
end,16:2:6,,,,,,,